<?xml version="1.0" encoding="UTF-8"?>
<!-- edited with XMLSpy v2010 (http://www.altova.com) by Rich Andrews (Skyline Innovations) -->
<xs:schema xmlns:xs="http://www.w3.org/2001/XMLSchema" elementFormDefault="qualified" attributeFormDefault="unqualified">
	<xs:element name="utilitybill">
		<xs:annotation>
			<xs:documentation>Root element</xs:documentation>
		</xs:annotation>
		<xs:complexType>
			<xs:sequence>
				<xs:element name="car">
					<xs:annotation>
						<xs:documentation>Customer Account Record.</xs:documentation>
					</xs:annotation>
					<xs:complexType>
						<xs:sequence>
							<xs:element name="accountnumber" type="xs:string">
								<xs:annotation>
									<xs:documentation>Customer account number used by the utility</xs:documentation>
								</xs:annotation>
							</xs:element>
							<xs:element name="serviceaddress" type="address">
								<xs:annotation>
									<xs:documentation>Location where utility service is received.</xs:documentation>
								</xs:annotation>
							</xs:element>
							<xs:element name="billingaddress" type="address">
								<xs:annotation>
									<xs:documentation>Location where bills are sent</xs:documentation>
								</xs:annotation>
							</xs:element>
						</xs:sequence>
					</xs:complexType>
				</xs:element>
				<xs:element name="uar">
					<xs:annotation>
						<xs:documentation>Utility Account Record - contact information for the utility.  Payee of this bill.</xs:documentation>
					</xs:annotation>
					<xs:complexType>
						<xs:sequence>
							<xs:element name="tin">
								<xs:annotation>
									<xs:documentation>Utility tax payer identification number</xs:documentation>
								</xs:annotation>
							</xs:element>
							<xs:element name="customerservice" type="address" minOccurs="0" maxOccurs="unbounded">
								<xs:annotation>
									<xs:documentation>Utility contact information including accessibility numbers, Spanish speaking representatives and other customer oriented care.</xs:documentation>
								</xs:annotation>
							</xs:element>
							<xs:element name="paymentlocation" type="address" minOccurs="0" maxOccurs="unbounded">
								<xs:annotation>
									<xs:documentation>Physical locations where payment can be made or sent.</xs:documentation>
								</xs:annotation>
							</xs:element>
							<xs:element name="suppliercontact" type="address" minOccurs="0"/>
							<xs:element name="emergencycontact" type="address" minOccurs="0">
								<xs:annotation>
									<xs:documentation>Contact information for emergency related to service location.</xs:documentation>
								</xs:annotation>
							</xs:element>
							<xs:element name="utilitycommission" type="address" minOccurs="0">
								<xs:annotation>
									<xs:documentation>Regulatory commission.</xs:documentation>
								</xs:annotation>
							</xs:element>
							<xs:element name="writteninquiries" type="address" minOccurs="0"/>
							<xs:element name="missutility" type="address" minOccurs="0">
								<xs:annotation>
									<xs:documentation>Utility/contractor coordinate number.</xs:documentation>
								</xs:annotation>
							</xs:element>
							<xs:element name="serviceoutage" type="address" minOccurs="0"/>
						</xs:sequence>
					</xs:complexType>
				</xs:element>
				<xs:element name="unknownaddress" minOccurs="0" maxOccurs="unbounded">
					<xs:annotation>
						<xs:documentation>Address records not accounted for yet present in bill.</xs:documentation>
					</xs:annotation>
					<xs:complexType>
						<xs:complexContent>
							<xs:extension base="address">
								<xs:attribute name="description" use="required"/>
							</xs:extension>
						</xs:complexContent>
					</xs:complexType>
				</xs:element>
				<xs:element name="summary">
					<xs:annotation>
						<xs:documentation>Bill summary.</xs:documentation>
					</xs:annotation>
					<xs:complexType>
						<xs:sequence>
							<xs:element name="priorbalance" type="xs:decimal">
								<xs:annotation>
									<xs:documentation>Balance from last bill.</xs:documentation>
								</xs:annotation>
							</xs:element>
							<xs:element name="previouspayment" type="payment" maxOccurs="unbounded">
								<xs:annotation>
									<xs:documentation>Previous payments after last bill</xs:documentation>
								</xs:annotation>
							</xs:element>
							<xs:element name="adjustment" type="payment" minOccurs="0" maxOccurs="unbounded">
								<xs:annotation>
									<xs:documentation>Charges and credit for late fees as well as unknown reasons.</xs:documentation>
								</xs:annotation>
							</xs:element>
							<xs:element name="balanceforward" type="xs:decimal" minOccurs="0">
								<xs:annotation>
									<xs:documentation>Balance forward for this bill</xs:documentation>
								</xs:annotation>
							</xs:element>
							<xs:element name="billperiodbegin" type="xs:date">
								<xs:annotation>
									<xs:documentation>Begin date for this bill.</xs:documentation>
								</xs:annotation>
							</xs:element>
							<xs:element name="billperiodend" type="xs:date">
								<xs:annotation>
									<xs:documentation>End date for this bill.</xs:documentation>
								</xs:annotation>
							</xs:element>
							<xs:element name="issuedate" type="xs:date">
								<xs:annotation>
									<xs:documentation>Date the bill is issued for customer.</xs:documentation>
								</xs:annotation>
							</xs:element>
							<xs:element name="currentcharges" maxOccurs="2">
								<xs:annotation>
									<xs:documentation>Total for this bill period including distribution and service lates fees, taxes and various other charges.</xs:documentation>
								</xs:annotation>
								<xs:complexType>
									<xs:simpleContent>
										<xs:extension base="xs:decimal">
											<xs:attributeGroup ref="service"/>
										</xs:extension>
									</xs:simpleContent>
								</xs:complexType>
							</xs:element>
							<xs:element name="totaldue" type="xs:decimal">
								<xs:annotation>
									<xs:documentation>Total account balance (consider renaming it to) for entire bill including all payees, previous balance, late fees.</xs:documentation>
								</xs:annotation>
							</xs:element>
							<xs:element name="duedate" type="xs:date">
								<xs:annotation>
									<xs:documentation>Date bill is due payable.</xs:documentation>
								</xs:annotation>
							</xs:element>
							<xs:element name="latepayment">
								<xs:annotation>
									<xs:documentation>Penalty if bill not paid by due date.</xs:documentation>
								</xs:annotation>
								<xs:complexType>
									<xs:sequence>
										<xs:element name="penalty">
											<xs:annotation>
												<xs:documentation>Percentage charge of total bill for missed due date</xs:documentation>
											</xs:annotation>
										</xs:element>
										<xs:element name="amount">
											<xs:annotation>
												<xs:documentation>Amount of late payment fee</xs:documentation>
											</xs:annotation>
										</xs:element>
									</xs:sequence>
								</xs:complexType>
							</xs:element>
						</xs:sequence>
					</xs:complexType>
				</xs:element>
				<xs:element name="details" maxOccurs="2">
					<xs:annotation>
						<xs:documentation>Details necessary for bill computation.</xs:documentation>
					</xs:annotation>
					<xs:complexType>
						<xs:sequence>
							<xs:element name="rateschedule">
								<xs:annotation>
									<xs:documentation>Name of rate.</xs:documentation>
								</xs:annotation>
								<xs:complexType>
									<xs:sequence>
										<xs:element name="name"/>
										<xs:element name="rateineffect" minOccurs="0"/>
									</xs:sequence>
								</xs:complexType>
							</xs:element>
							<xs:element name="chargegroup" maxOccurs="4">
								<xs:annotation>
									<xs:documentation>Group of charges by generation/supply, transmission, distribution or taxation</xs:documentation>
								</xs:annotation>
								<xs:complexType>
									<xs:sequence>
										<xs:element name="charges">
											<xs:annotation>
												<xs:documentation>Detail charges for distribution.</xs:documentation>
											</xs:annotation>
											<xs:complexType>
												<xs:sequence>
													<xs:element name="charge" type="charge" maxOccurs="unbounded"/>
												</xs:sequence>
											</xs:complexType>
										</xs:element>
										<xs:element name="subtotal" minOccurs="0">
											<xs:simpleType>
												<xs:restriction base="xs:decimal">
													<xs:fractionDigits value="2"/>
												</xs:restriction>
											</xs:simpleType>
										</xs:element>
									</xs:sequence>
									<xs:attribute name="type" use="required">
										<xs:simpleType>
											<xs:restriction base="xs:string">
												<xs:enumeration value="Generation/Supply"/>
												<xs:enumeration value="Transmission"/>
												<xs:enumeration value="Distribution"/>
												<xs:enumeration value="Tax"/>
											</xs:restriction>
										</xs:simpleType>
									</xs:attribute>
								</xs:complexType>
							</xs:element>
							<xs:element name="total" type="xs:decimal"/>
						</xs:sequence>
						<xs:attributeGroup ref="service"/>
					</xs:complexType>
				</xs:element>
				<xs:element name="billableusage" maxOccurs="2">
					<xs:annotation>
						<xs:documentation>Billable usage which may differ from measured usage</xs:documentation>
					</xs:annotation>
					<xs:complexType>
						<xs:sequence>
							<xs:element name="rateschedule">
								<xs:complexType>
									<xs:sequence>
										<xs:element name="name"/>
										<xs:element name="rateineffect" minOccurs="0"/>
									</xs:sequence>
								</xs:complexType>
							</xs:element>
							<xs:element name="usage" type="usage" minOccurs="0" maxOccurs="unbounded"/>
							<xs:element name="total" minOccurs="0">
								<xs:annotation>
									<xs:documentation>total billable</xs:documentation>
								</xs:annotation>
							</xs:element>
						</xs:sequence>
						<xs:attributeGroup ref="service"/>
					</xs:complexType>
				</xs:element>
				<xs:element name="measuredusage" maxOccurs="2">
					<xs:annotation>
						<xs:documentation>Meters associated with service location.</xs:documentation>
					</xs:annotation>
					<xs:complexType>
						<xs:sequence>
							<xs:element name="meter" maxOccurs="unbounded">
								<xs:complexType>
									<xs:complexContent>
										<xs:extension base="meter"/>
									</xs:complexContent>
								</xs:complexType>
							</xs:element>
							<xs:element name="nextreaddate" type="xs:date" minOccurs="0">
								<xs:annotation>
									<xs:documentation>For premises wide next read date.</xs:documentation>
								</xs:annotation>
							</xs:element>
						</xs:sequence>
						<xs:attributeGroup ref="service"/>
					</xs:complexType>
				</xs:element>
				<xs:element name="usagehistory" minOccurs="0" maxOccurs="2">
					<xs:annotation>
						<xs:documentation>Summary of prior usage by period.</xs:documentation>
					</xs:annotation>
					<xs:complexType>
						<xs:sequence>
							<xs:element name="usage" maxOccurs="unbounded">
								<xs:complexType>
									<xs:sequence>
										<xs:element name="date" type="xs:date">
											<xs:annotation>
												<xs:documentation>usage period date, usually in the form of YYYY-MM use DD 01 if missing.</xs:documentation>
											</xs:annotation>
										</xs:element>
										<xs:element name="days" type="xs:integer" minOccurs="0">
											<xs:annotation>
												<xs:documentation>Number of days in period.</xs:documentation>
											</xs:annotation>
										</xs:element>
										<xs:element name="register">
											<xs:annotation>
												<xs:documentation>Net and submeter registers. May be identified by id or type/bucket.</xs:documentation>
											</xs:annotation>
											<xs:complexType>
												<xs:sequence>
													<xs:element name="identifier"/>
													<xs:element name="total">
														<xs:complexType>
															<xs:simpleContent>
																<xs:extension base="xs:integer">
																	<xs:attribute name="units"/>
																</xs:extension>
															</xs:simpleContent>
														</xs:complexType>
													</xs:element>
												</xs:sequence>
											</xs:complexType>
										</xs:element>
										<xs:element name="total">
											<xs:complexType>
												<xs:simpleContent>
													<xs:extension base="xs:integer">
														<xs:attribute name="units"/>
													</xs:extension>
												</xs:simpleContent>
											</xs:complexType>
										</xs:element>
									</xs:sequence>
								</xs:complexType>
							</xs:element>
						</xs:sequence>
						<xs:attributeGroup ref="service"/>
					</xs:complexType>
				</xs:element>
			</xs:sequence>
			<xs:attribute name="id" use="required">
				<xs:annotation>
					<xs:documentation>The unique SI identifier for this bill</xs:documentation>
				</xs:annotation>
			</xs:attribute>
		</xs:complexType>
	</xs:element>
	<xs:complexType name="address">
		<xs:sequence>
			<xs:element name="addressee"/>
			<xs:element name="street"/>
			<xs:element name="city"/>
			<xs:element name="state"/>
			<xs:element name="country"/>
			<xs:element name="postalcode"/>
			<xs:element name="telephonenumber"/>
			<xs:element name="hours"/>
		</xs:sequence>
	</xs:complexType>
	<xs:complexType name="meter">
		<xs:sequence>
			<xs:element name="estimated" type="xs:boolean"/>
			<xs:element name="priorreaddate" type="xs:date" minOccurs="0"/>
			<xs:element name="presentreaddate" type="xs:date" minOccurs="0"/>
			<xs:element name="nextreaddate" type="xs:date" minOccurs="0"/>
			<xs:element name="identifier">
				<xs:annotation>
					<xs:documentation>Identifier for the physical meter</xs:documentation>
				</xs:annotation>
			</xs:element>
			<xs:element name="register" maxOccurs="unbounded">
				<xs:annotation>
					<xs:documentation>Registers.  May be identified by id or type/bucket. (e.g. kWh)</xs:documentation>
				</xs:annotation>
				<xs:complexType>
					<xs:sequence>
						<xs:element name="identifier">
							<xs:annotation>
								<xs:documentation>Identifier for register.  Use meter identifier if unavailable.</xs:documentation>
							</xs:annotation>
						</xs:element>
						<xs:element name="description"/>
						<xs:element name="units" type="xs:string" minOccurs="0"/>
						<xs:element name="priorreading" type="xs:decimal" minOccurs="0"/>
						<xs:element name="presentreading" type="xs:decimal" minOccurs="0"/>
						<xs:element name="factor" type="xs:integer" minOccurs="0"/>
						<xs:element name="total" type="xs:decimal"/>
					</xs:sequence>
				</xs:complexType>
			</xs:element>
		</xs:sequence>
	</xs:complexType>
	<xs:complexType name="amount"/>
	<xs:complexType name="supplier"/>
	<xs:complexType name="payment">
		<xs:sequence>
			<xs:element name="payee"/>
			<xs:element name="amount" type="xs:decimal"/>
			<xs:element name="date" type="xs:date" minOccurs="0"/>
		</xs:sequence>
	</xs:complexType>
	<xs:complexType name="charge">
		<xs:all>
			<xs:element name="snubchargeid" minOccurs="0">
				<xs:annotation>
					<xs:documentation>Reference to normalized charge item</xs:documentation>
				</xs:annotation>
			</xs:element>
			<xs:element name="description"/>
			<xs:element name="quantity" minOccurs="0">
				<xs:complexType mixed="true">
					<xs:attribute name="units"/>
				</xs:complexType>
			</xs:element>
			<xs:element name="rate" minOccurs="0">
				<xs:complexType>
					<xs:simpleContent>
						<xs:extension base="xs:decimal">
							<xs:attribute name="units"/>
						</xs:extension>
					</xs:simpleContent>
				</xs:complexType>
			</xs:element>
			<xs:element name="total" nillable="false">
				<xs:simpleType>
					<xs:restriction base="xs:decimal"/>
				</xs:simpleType>
			</xs:element>
		</xs:all>
	</xs:complexType>
	<xs:complexType name="usage">
		<xs:all>
			<xs:element name="description"/>
			<xs:element name="quantity">
				<xs:complexType>
					<xs:simpleContent>
						<xs:extension base="xs:decimal">
							<xs:attribute name="units">
								<xs:simpleType>
									<xs:restriction base="xs:string">
										<xs:enumeration value="kWh"/>
										<xs:enumeration value="CCF"/>
										<xs:enumeration value="kW"/>
									</xs:restriction>
								</xs:simpleType>
							</xs:attribute>
						</xs:extension>
					</xs:simpleContent>
				</xs:complexType>
			</xs:element>
		</xs:all>
	</xs:complexType>
	<xs:attributeGroup name="service">
		<xs:attribute name="service" use="required">
			<xs:simpleType>
				<xs:restriction base="xs:string">
					<xs:enumeration value="gas"/>
					<xs:enumeration value="electric"/>
				</xs:restriction>
			</xs:simpleType>
		</xs:attribute>
	</xs:attributeGroup>
</xs:schema>
