<?xml version="1.0" encoding="UTF-8"?>
<!-- edited with XMLSpy v2010 (http://www.altova.com) by Rich Andrews (self) -->
<utilitybill id="" xmlns:xsi="http://www.w3.org/2001/XMLSchema-instance" xsi:noNamespaceSchemaLocation="..\UtilityBill.xsd">
	<car>
		<accountnumber>94443-01819</accountnumber>
		<serviceaddress>
			<addressee>T C Commons</addressee>
			<street>1103 West Chester PI, ST 12-A</street>
			<city>West Chester</city>
			<state>PA</state>
			<country>USA</country>
			<postalcode/>
			<telephonenumber>610-688-8985</telephonenumber>
			<hours/>
		</serviceaddress>
		<billingaddress>
			<addressee>T C Commons</addressee>
			<street>C/O Family Laundry Mat</street>
			<city>West Chester</city>
			<state>PA</state>
			<country>USA</country>
			<postalcode>19382-5004</postalcode>
			<telephonenumber/>
			<hours/>
		</billingaddress>
	</car>
	<uar>
		<tin/>
		<customerservice>
			<addressee>Business Account Services PECO</addressee>
			<street>2301 Market St.</street>
			<city>Philadelphia</city>
			<state>PA</state>
			<country>USA</country>
			<postalcode>19101</postalcode>
			<telephonenumber>800-980-9655</telephonenumber>
			<hours/>
		</customerservice>
		<paymentlocation>
			<addressee>PECO Energy - Payment Processing</addressee>
			<street>PO Box 37629</street>
			<city>Philadelphia</city>
			<state>PA</state>
			<country>USA</country>
			<postalcode>19101</postalcode>
			<telephonenumber/>
			<hours/>
		</paymentlocation>
		<paymentlocation>
			<addressee>PECO Energy</addressee>
			<street>2301 Market St.</street>
			<city>Philadelphia</city>
			<state>PA</state>
			<country>USA</country>
			<postalcode>19101</postalcode>
			<telephonenumber>1-877-432-9384</telephonenumber>
			<hours>M-F 8:30-5PM</hours>
		</paymentlocation>
	</uar>
	<summary>
		<priorbalance>0.0</priorbalance>
		<previouspayment>
			<payee>PECO</payee>
			<amount>2501.91</amount>
		</previouspayment>
		<billperiodbegin>2009-09-03</billperiodbegin>
		<billperiodend>2009-10-05</billperiodend>
		<issuedate>2009-10-06</issuedate>
		<currentcharges>955.91</currentcharges>
		<totaldue>2566.44</totaldue>
		<duedate>2009-10-28</duedate>
		<latepayment>
			<penalty/>
			<amount/>
		</latepayment>
	</summary>
	<currentcharges>
		<distributer>
			<priorbalance/>
			<payment/>
			<balanceforward/>
			<currentcharges/>
		</distributer>
		<supplier name="">
			<priorbalance/>
			<payment/>
			<balanceforward/>
			<currentcharges/>
		</supplier>
	</currentcharges>
	<details>
		<rateschedule>
			<name/>
		</rateschedule>
		<distribution>
			<charges>
				<charge>
					<description/>
					<total/>
				</charge>
			</charges>
			<total/>
		</distribution>
		<service>
			<charges>
				<charge>
					<description/>
					<total/>
				</charge>
			</charges>
			<total/>
		</service>
		<tax>
			<charges>
				<charge>
					<description/>
					<total/>
				</charge>
			</charges>
			<total/>
		</tax>
		<total/>
	</details>
	<billableusage>
		<rateschedule>
			<name/>
		</rateschedule>
	</billableusage>
	<measuredusage>
		<meter type="">
			<estimated/>
			<identifier>027870434</identifier>
			<register>
				<identifier/>
				<description/>
				<total/>
			</register>
		</meter>
		<meter type="">
			<estimated/>
			<identifier>028702956</identifier>
			<register>
				<identifier/>
				<description/>
				<total/>
			</register>
		</meter>
		<meter type="">
			<estimated/>
			<identifier>084010385</identifier>
			<register>
				<identifier/>
				<description/>
				<total/>
			</register>
		</meter>
		<nextreaddate>2009-11-04</nextreaddate>
	</measuredusage>
</utilitybill>
